,ID_UC,Nome da UC,Ano de Criação,Esfera Administrativa
0,1,ÁREA DE PROTEÇÃO AMBIENTAL ANHATOMIRIM,1992,Federal
1,2,ÁREA DE PROTEÇÃO AMBIENTAL CAVERNAS DO PERUAÇU,1989,Federal
2,3,ÁREA DE PROTEÇÃO AMBIENTAL DA BACIA DO RIO DESCOBERTO,1983,Federal
3,4,ÁREA DE PROTEÇÃO AMBIENTAL DA BACIA DO RIO SÃO BARTOLOMEU,1983,Federal
4,5,ÁREA DE PROTEÇÃO AMBIENTAL DA BACIA DO RIO SÃO JOÃO - MICO LEÃO,2002,Federal
5,6,ÁREA DE PROTEÇÃO AMBIENTAL DA BALEIA FRANCA,2000,Federal
6,7,ÁREA DE PROTEÇÃO AMBIENTAL BARRA DO RIO MAMANGUAPE,1993,Federal
7,8,ÁREA DE PROTEÇÃO AMBIENTAL CHAPADA DO ARARIPE,1997,Federal
8,9,ÁREA DE PROTEÇÃO AMBIENTAL COSTA DOS CORAIS,1997,Federal
9,10,ÁREA DE PROTEÇÃO AMBIENTAL DE PETRÓPOLIS,1982,Federal
10,11,ÁREA DE PROTEÇÃO AMBIENTAL SERRA DA MANTIQUEIRA,1985,Federal
11,12,ÁREA DE PROTEÇÃO AMBIENTAL SERRA DA TABATINGA,1990,Federal
12,13,ÁREA DE PROTEÇÃO AMBIENTAL DE CAIRUÇU,1983,Federal
13,14,ÁREA DE PROTEÇÃO AMBIENTAL DE CANANÉIA-IGUAPÉ-PERUÍBE,1984,Federal
14,15,ÁREA DE PROTEÇÃO AMBIENTAL DE FERNANDO DE NORONHA,1986,Federal
15,16,ÁREA DE PROTEÇÃO AMBIENTAL DE GUAPI-MIRIM,1984,Federal
16,17,ÁREA DE PROTEÇÃO AMBIENTAL DE GUARAQUEÇABA,1985,Federal
17,18,ÁREA DE PROTEÇÃO AMBIENTAL DE PIAÇABUÇU,1983,Federal
18,19,ÁREA DE PROTEÇÃO AMBIENTAL DELTA DO PARNAIBA,1996,Federal
19,20,ÁREA DE PROTEÇÃO AMBIENTAL CARSTE DA LAGOA SANTA,1990,Federal
20,21,ÁREA DE PROTEÇÃO AMBIENTAL IBIRAPUITÃ,1992,Federal
21,22,ÁREA DE PROTEÇÃO AMBIENTAL DO IGARAPÉ GELADO,1989,Federal
22,23,ÁREA DE PROTEÇÃO AMBIENTAL DO PLANALTO CENTRAL,2002,Federal
23,24,ÁREA DE PROTEÇÃO AMBIENTAL MEANDROS DO ARAGUAIA,1998,Federal
24,25,ÁREA DE PROTEÇÃO AMBIENTAL ILHAS E VÁRZEAS DO RIO PARANÁ,1997,Federal
25,27,ÁREA DE PROTEÇÃO AMBIENTAL MORRO DA PEDREIRA,1990,Federal
26,28,ÁREA DE PROTEÇÃO AMBIENTAL DAS NASCENTES DO RIO VERMELHO,2001,Federal
27,29,ÁREA DE PROTEÇÃO AMBIENTAL SERRA DA IBIAPABA,1996,Federal
28,30,ÁREA DE RELEVANTE INTERESSE ECOLÓGICO BURITI DE VASSUNUNGA,1990,Federal
29,31,ÁREA DE RELEVANTE INTERESSE ECOLÓGICA CAPETINGA/TAQUARA,1985,Federal
30,32,ÁREA DE RELEVANTE INTERESSE ECOLÓGICA PÉ-DE-GIGANTE,1990,Federal
31,34,MONUMENTO NATURAL DAS ILHAS CAGARRAS,1989,Federal
32,35,ÁREA DE RELEVANTE INTERESSE ECOLÓGICA FLORESTA DA CICUTA,1985,Federal
33,36,ÁREA DE RELEVANTE INTERESSE ECOLÓGICA ILHA AMEIXAL,1985,Federal
34,37,ÁREA DE RELEVANTE INTERESSE ECOLÓGICO ILHAS QUEIMADA GRANDE E QUEIMADA PEQUENA,1985,Federal
35,38,ÁREA DE RELEVANTE INTERESSE ECOLÓGICA JAVARI BURITI,1985,Federal
36,39,ÁREA DE RELEVANTE INTERESSE ECOLÓGICA MANGUEZAIS DA FOZ DO RIO MAMANGUAPE,1985,Federal
37,40,ÁREA DE RELEVANTE INTERESSE ECOLÓGICA MATA DE SANTA GENEBRA,1985,Federal
38,41,ÁREA DE RELEVANTE INTERESSE ECOLÓGICA MATÃO DE COSMÓPOLIS,1985,Federal
39,43,ÁREA DE RELEVANTE INTERESSE ECOLÓGICA PROJETO DINÂMICA BIOLÓGICA DE FRAGMENTOS FLORESTAIS,1985,Federal
40,44,ÁREA DE RELEVANTE INTERESSE ECOLÓGICA SERINGAL NOVA ESPERANÇA,1999,Federal
41,45,ÁREA DE RELEVANTE INTERESSE ECOLÓGICA SERRA DA ABELHA,1996,Federal
42,47,ESTAÇÃO ECOLÓGICA DA TERRA DO MEIO,2005,Federal
43,48,ESTAÇÃO ECOLÓGICA DE AIUABA,2001,Federal
44,49,PARQUE NACIONAL DE ANAVILHANAS,1981,Federal
45,50,ESTAÇÃO ECOLÓGICA DE ARACURI-ESMERALDA,1981,Federal
46,52,ESTAÇÃO ECOLÓGICA DE CARIJÓS,1987,Federal
47,53,ESTAÇÃO ECOLÓGICA DE CUNIÃ,2001,Federal
48,54,ESTAÇÃO ECOLÓGICA DE GUARAQUEÇABA,1982,Federal
49,56,ESTAÇÃO ECOLÓGICA DE JUTAÍ-SOLIMÕES,1983,Federal
50,57,ESTAÇÃO ECOLÓGICA DE MARACÁ,1981,Federal
51,58,ESTAÇÃO ECOLÓGICA DE MARACÁ JIPIOCA,1981,Federal
52,59,ESTAÇÃO ECOLÓGICA DE MURICI,2001,Federal
53,60,ESTAÇÃO ECOLÓGICA DE NIQUIÁ,1985,Federal
54,61,ESTAÇÃO ECOLÓGICA DE PIRAPITINGA,1987,Federal
55,62,ESTAÇÃO ECOLÓGICA DE TAIAMÃ,1981,Federal
56,63,ESTAÇÃO ECOLÓGICA DE TAMOIOS,1990,Federal
57,64,ESTAÇÃO ECOLÓGICA TUPINAMBÁS,1987,Federal
58,65,ESTAÇÃO ECOLÓGICA DE URUÇUÍ-UNA,1981,Federal
59,66,ESTAÇÃO ECOLÓGICA DO CASTANHÃO,2001,Federal
60,67,ESTAÇÃO ECOLÓGICA DO JARI,1982,Federal
61,68,ESTAÇÃO ECOLÓGICA RIO ACRE,1981,Federal
62,69,ESTAÇÃO ECOLÓGICA DO SERIDÓ,1982,Federal
63,70,ESTAÇÃO ECOLÓGICA DO TAIM,1986,Federal
64,71,ESTAÇÃO ECOLÓGICA DOS TUPINIQUINS,1986,Federal
65,72,ESTAÇÃO ECOLÓGICA JUAMI-JAPURÁ,1985,Federal
66,73,ESTAÇÃO ECOLÓGICA MICO LEÃO PRETO,2002,Federal
67,74,ESTAÇÃO ECOLÓGICA RASO DA CATARINA,1984,Federal
68,75,ESTAÇÃO ECOLÓGICA DA SERRA DAS ARARAS,1982,Federal
69,76,ESTACAO ECOLOGICA SERRA GERAL DO TOCANTINS,2001,Federal
70,77,FLORESTA NACIONAL DE ASSUNGUI,1968,Federal
71,78,FLORESTA NACIONAL DE CAÇADOR,1968,Federal
72,79,FLORESTA NACIONAL DE CAPÃO BONITO,1968,Federal
73,80,FLORESTA NACIONAL DE CHAPECÓ,1968,Federal
74,81,FLORESTA NACIONAL DE CONTENDAS DO SINCORÁ,1999,Federal
75,82,FLORESTA NACIONAL DE AÇU,1950,Federal
76,83,FLORESTA NACIONAL ALTAMIRA,1998,Federal
77,84,FLORESTA NACIONAL DE ANAUÁ,2005,Federal
78,85,FLORESTA NACIONAL DE BALATA-TUFARI,2005,Federal
79,86,FLORESTA NACIONAL DE BRASÍLIA,1999,Federal
80,87,FLORESTA NACIONAL DE CANELA,1968,Federal
81,88,FLORESTA NACIONAL DE CARAJÁS,1998,Federal
82,89,FLORESTA NACIONAL DE CAXIUANÃ,1961,Federal
83,90,FLORESTA NACIONAL DE CRISTÓPOLIS,2001,Federal
84,91,FLORESTA NACIONAL DE GOYTACAZES,2002,Federal
85,92,FLORESTA NACIONAL DE HUMAITÁ,1998,Federal
86,93,FLORESTA NACIONAL DE IBIRAMA,1988,Federal
87,94,FLORESTA NACIONAL DE IPANEMA,1992,Federal
88,95,FLORESTA NACIONAL DE ITAITUBA I,1998,Federal
89,96,FLORESTA NACIONAL DE ITAITUBA II,1998,Federal
90,97,FLORESTA NACIONAL DE JACUNDÁ,2004,Federal
91,98,FLORESTA NACIONAL DE LORENA,1934,Federal
92,99,FLORESTA NACIONAL DE MULATA,2001,Federal
93,100,FLORESTA NACIONAL DE NÍSIA FLORESTA,2001,Federal
94,101,FLORESTA NACIONAL DE PACOTUBA,2002,Federal
95,102,FLORESTA NACIONAL DE PALMARES,2005,Federal
96,103,FLORESTA NACIONAL DE PARAOPEBA,1950,Federal
97,104,FLORESTA NACIONAL DE PAU-ROSA,2001,Federal
98,105,FLORESTA NACIONAL DE RITÁPOLIS,1999,Federal
99,106,FLORESTA NACIONAL DE RORAIMA,1989,Federal
100,107,FLORESTA NACIONAL DE SANTA ROSA DO PURUS,2001,Federal
101,108,FLORESTA NACIONAL DE SÃO FRANCISCO,2001,Federal
102,109,FLORESTA NACIONAL DE SARACÁ-TAQUERA,1989,Federal
103,110,FLORESTA NACIONAL DE SILVÂNIA,1949,Federal
104,111,FLORESTA NACIONAL DE SOBRAL,1947,Federal
105,112,FLORESTA NACIONAL DE TEFÉ,1989,Federal
106,113,FLORESTA NACIONAL DE AMAPÁ,1989,Federal
107,114,FLORESTA NACIONAL DO AMAZONAS,1989,Federal
108,115,FLORESTA NACIONAL DO ARARIPE-APODI,1946,Federal
109,116,FLORESTA NACIONAL DE BOM FUTURO,1988,Federal
110,117,FLORESTA NACIONAL DE ITACAIUNAS,1998,Federal
111,118,FLORESTA NACIONAL DO JAMARI,1984,Federal
112,119,FLORESTA NACIONAL DE JATUARANA,2002,Federal
113,120,FLORESTA NACIONAL DE MACAUÃ,1988,Federal
114,121,FLORESTA NACIONAL DE PURUS,1988,Federal
115,122,FLORESTA NACIONAL DE RIO PRETO,1990,Federal
116,123,FLORESTA NACIONAL DE TAPAJÓS,1974,Federal
117,124,FLORESTA NACIONAL DE TAPIRAPÉ-AQUIRI,1989,Federal
118,125,FLORESTA NACIONAL DE IRATI,1968,Federal
119,126,FLORESTA NACIONAL DE MAPIÁ-INAUINÍ,1989,Federal
120,127,FLORESTA NACIONAL DE MÁRIO XAVIER,1986,Federal
121,128,FLORESTA NACIONAL DA MATA GRANDE,2003,Federal
122,129,FLORESTA NACIONAL DE PASSA QUATRO,1968,Federal
123,130,FLORESTA NACIONAL DE PASSO FUNDO,1968,Federal
124,131,FLORESTA NACIONAL DE PIRAÍ DO SUL,2004,Federal
125,132,FLORESTA NACIONAL DA RESTINGA DE CABEDELO,2004,Federal
126,133,FLORESTA NACIONAL DE SÃO FRANCISCO DE PAULA,1968,Federal
127,134,FLORESTA NACIONAL DE TRÊS BARRAS,1968,Federal
128,135,PARQUE NACIONAL CAVERNAS DO PERUAÇU,1999,Federal
129,136,PARQUE NACIONAL DA AMAZÔNIA,1974,Federal
130,137,PARQUE NACIONAL DA CHAPADA DIAMANTINA,1985,Federal
131,138,PARQUE NACIONAL DA CHAPADA DOS GUIMARÃES,1989,Federal
132,139,PARQUE NACIONAL DA CHAPADA DOS VEADEIROS,1961,Federal
133,140,PARQUE NACIONAL DA LAGOA DO PEIXE,1986,Federal
134,141,PARQUE NACIONAL RESTINGA DE JURUBATIBA,1998,Federal
135,142,PARQUE NACIONAL DA SERRA DA BOCAINA,1971,Federal
136,143,PARQUE NACIONAL DA SERRA DA BODOQUENA,2000,Federal
137,144,PARQUE NACIONAL DA SERRA DA CANASTRA,1972,Federal
138,145,PARQUE NACIONAL DA SERRA DA CAPIVARA,1979,Federal
139,146,PARQUE NACIONAL SERRA DAS CONFUSÕES,1998,Federal
140,147,PARQUE NACIONAL DA SERRA DE ITABAIANA,2005,Federal
141,148,PARQUE NACIONAL DA SERRA DO CIPÓ,1984,Federal
142,149,PARQUE NACIONAL DA SERRA DO DIVISOR,1989,Federal
143,150,PARQUE NACIONAL DA SERRA DO ITAJAÍ,2004,Federal
144,151,PARQUE NACIONAL DA SERRA DO PARDO,2005,Federal
145,152,PARQUE NACIONAL DA SERRA DOS ORGÃOS,1939,Federal
146,153,PARQUE NACIONAL DA SERRA GERAL,1992,Federal
147,154,PARQUE NACIONAL DA TIJUCA,1961,Federal
148,155,PARQUE NACIONAL DAS EMAS,1961,Federal
149,156,PARQUE NACIONAL DAS NASCENTES DO RIO PARNAIBA,2002,Federal
150,157,PARQUE NACIONAL DAS SEMPRE VIVAS,2002,Federal
151,158,PARQUE NACIONAL DE APARADOS DA SERRA,1959,Federal
152,159,PARQUE NACIONAL DE BRASÍLIA,1961,Federal
153,160,PARQUE NACIONAL DE CAPARAO,1961,Federal
154,161,PARQUE NACIONAL DE ILHA GRANDE,1997,Federal
155,162,PARQUE NACIONAL DE JERICOACOARA,2002,Federal
156,163,PARQUE NACIONAL DE PACAÁS NOVOS,1979,Federal
157,164,PARQUE NACIONAL DE SAINT-HILAIRE/LANGE,2001,Federal
158,165,PARQUE NACIONAL DE SÃO JOAQUIM,1961,Federal
159,166,PARQUE NACIONAL DE SETE CIDADES,1961,Federal
160,167,PARQUE NACIONAL DE UBAJARA,1959,Federal
161,168,PARQUE NACIONAL DO ARAGUAIA,1959,Federal
162,169,PARQUE NACIONAL DO CABO ORANGE,1980,Federal
163,170,PARQUE NACIONAL DO CATIMBAU,2002,Federal
164,171,PARQUE NACIONAL DO DESCOBRIMENTO,1999,Federal
165,172,PARQUE NACIONAL DO IGUAÇU,1939,Federal
166,173,PARQUE NACIONAL DO JAÚ,1980,Federal
167,174,PARQUE NACIONAL DO MONTE RORAIMA,1989,Federal
168,175,PARQUE NACIONAL DO PANTANAL MATOGROSSENSE,1981,Federal
169,176,PARQUE NACIONAL PAU BRASIL,1999,Federal
170,177,PARQUE NACIONAL DO PICO DA NEBLINA,1979,Federal
171,178,PARQUE NACIONAL DO SUPERAGUI,1989,Federal
172,179,PARQUE NACIONAL VIRUÁ,1998,Federal
173,180,PARQUE NACIONAL DOS LENÇOIS MARANHENSES,1981,Federal
174,181,MONUMENTO NATURAL DOS PONTÕES CAPIXABAS,2002,Federal
175,182,PARQUE NACIONAL DO MONTE PASCOAL,1961,Federal
176,183,PARQUE NACIONAL GRANDE SERTÃO VEREDAS,1989,Federal
177,184,PARQUE NACIONAL DO ITATIAIA,1937,Federal
178,185,PARQUE NACIONAL MARINHO DOS ABROLHOS,1983,Federal
179,186,PARQUE NACIONAL MAR. DE FERNANDO DE NORONHA,1988,Federal
180,187,PARQUE NACIONAL MONTANHAS DO TUMUCUMAQUE,2002,Federal
181,188,PARQUE NACIONAL DA SERRA DA CUTIA,2001,Federal
182,189,PARQUE NACIONAL SERRA DA MOCIDADE,1998,Federal
183,190,REFUGIO DE VIDA SILVESTRE ILHA DOS LOBOS,1983,Federal
184,191,RESERVA BIOLÓGICA AUGUSTO RUSCHI,1982,Federal
185,192,RESERVA BIOLÓGICA DA CONTAGEM,2002,Federal
186,193,RESERVA BIOLÓGICA DA MATA ESCURA,2003,Federal
187,194,RESERVA BIOLÓGICA DO ABUFARI,1982,Federal
188,195,RESERVA BIOLÓGICA DE COMBOIOS,1984,Federal
189,196,RESERVA BIOLÓGICA GUARIBAS,1990,Federal
190,197,RESERVA BIOLOGICA DE PEDRA TALHADA,1989,Federal
191,198,RESERVA BIOLÓGICA DE SALTINHO,1983,Federal
192,199,RESERVA BIOLÓGICA DE SANTA ISABEL,1988,Federal
193,200,RESERVA BIOLÓGICA DE SERRA NEGRA,1982,Federal
194,201,RESERVA BIOLÓGICA DE SOORETAMA,1982,Federal
195,202,RESERVA BIOLÓGICA DE UNA,1980,Federal
196,203,RESERVA BIOLÓGICA ATOL DAS ROCAS,1979,Federal
197,204,RESERVA BIOLÓGICA DO CÓRREGO DO VEADO,1982,Federal
198,205,RESERVA BIOLÓGICA DO CÓRREGO GRANDE,1989,Federal
199,206,RESERVA BIOLÓGICA DO GUAPORÉ,1982,Federal
200,207,RESERVA BIOLÓGICA DO GURUPI,1988,Federal
201,208,RESERVA BIOLÓGICA DO JARU,1979,Federal
202,209,RESERVA BIOLÓGICA DO LAGO PIRATUBA,1980,Federal
203,210,RESERVA BIOLÓGICA DO RIO TROMBETAS,1979,Federal
204,211,RESERVA BIOLÓGICA DO TAPIRAPÉ,1989,Federal
205,212,RESERVA BIOLÓGICA DO TINGUÁ,1989,Federal
206,213,RESERVA BIOLÓGICA DO UATUMÃ,1990,Federal
207,214,RESERVA BIOLÓGICA MARINHA DO ARVOREDO,1990,Federal
208,215,RESERVA BIOLÓGICA DE POÇO DAS ANTAS,1974,Federal
209,216,RESERVA BIOLÓGICA NASCENTES SERRA DO CACHIMBO,2005,Federal
210,217,RESERVA BIOLÓGICA UNIÃO,1998,Federal
211,218,RESERVA DE DESENVOLVIMENTO SUSTENTÁVEL ITATUPÃ-BAQUIÁ,2005,Federal
212,219,REFUGIO DE VIDA SILVESTRE VEREDAS DO OESTE BAIANO,2002,Federal
213,220,RESERVA EXTRATIVISTA AUATÍ-PARANÁ,2001,Federal
214,221,RESERVA EXTRATIVISTA BARREIRO DAS ANTAS,2001,Federal
215,222,RESERVA EXTRATIVISTA CHICO MENDES,1990,Federal
216,223,RESERVA EXTRATIVISTA CHOCOARÉ-MATO GROSSO,2002,Federal
217,225,RESERVA EXTRATIVISTA MARINHA DO DELTA DO PARNAIBA,2000,Federal
218,226,RESERVA EXTRATIVISTA MATA GRANDE,1992,Federal
219,227,RESERVA EXTRATIVISTA MARACANÃ,2002,Federal
220,228,RESERVA EXTRATIVISTA SÃO JOÃO DA PONTA,2002,Federal
221,230,RESERVA EXTRATIVISTA BAIXO JURUÁ,2001,Federal
222,231,RESERVA EXTRATIVISTA DO BATOQUE,2003,Federal
223,232,RESERVA EXTRATIVISTA DO CAZUMBÁ-IRACEMA,2002,Federal
224,233,RESERVA EXTRATIVISTA LAGO DO CUNIÃ,1999,Federal
225,234,RESERVA EXTRATIVISTA MANDIRA,2002,Federal
226,235,RESERVA EXTRATIVISTA MÉDIO JURUÁ,1997,Federal
227,238,RESERVA EXTRATIVISTA DO RIO CAUTÁRIO,2001,Federal
228,239,RESERVA EXTRATIVISTA DO RIO JUTAÍ,2002,Federal
229,240,RESERVA EXTRATIVISTA EXTREMO NORTE DO TOCANTINS,1992,Federal
230,241,RESERVA EXTRATIVISTA IPAÚ-ANILZINHO,2005,Federal
231,242,RESERVA EXTRATIVISTA DO LAGO DO CAPANÃ GRANDE,2004,Federal
232,243,RESERVA EXTRATIVISTA MAE GRANDE DE CURUÇA,2002,Federal
233,244,RESERVA EXTRATIVISTA MAPUÁ,2005,Federal
234,245,RESERVA EXTRATIVISTA MARINHA DA BAIA DE IGUAPÉ,2000,Federal
235,246,RESERVA EXTRATIVISTA MARINHA DA LAGOA DO JEQUIÁ,2001,Federal
236,247,RESERVA EXTRATIVISTA MARINHA ARAI-PEROBA,2005,Federal
237,248,RESERVA EXTRATIVISTA MARINHA CAETÉTAPERAÇU,2005,Federal
238,249,RESERVA EXTRATIVISTA MARINHA DE GURUPI-PIRIÁ,2005,Federal
239,250,RESERVA EXTRATIVISTA MARINHA TRACUATEUA,2005,Federal
240,251,RESERVA EXTRATIVISTA MARINHA ARRAIAL DO CABO,1997,Federal
241,252,RESERVA EXTRATIVISTA CORUMBAU,2000,Federal
242,253,RESERVA EXTRATIVISTA DE CANAVIEIRAS,2006,Federal
243,254,RESERVA EXTRATIVISTA MARINHA DE SOURE,2001,Federal
244,255,RESERVA EXTRATIVISTA MARINHA PIRAJUBAÉ,1992,Federal
245,256,RESERVA EXTRATIVISTA RIO OURO PRETO,1990,Federal
246,257,RESERVA EXTRATIVISTA RIOZINHO DA LIBERDADE,2005,Federal
247,258,RESERVA EXTRATIVISTA RIOZINHO DO ANFRÍSIO,2004,Federal
248,259,RESERVA EXTRATIVISTA TAPAJÓS ARAPIUNS,1998,Federal
249,260,RESERVA EXTRATIVISTA VERDE PARA SEMPRE,2004,Federal
250,261,ESTAÇÃO ECOLÓGICA DE MATA PRETA,2005,Federal
251,262,PARQUE NACIONAL DAS ARAUCÁRIAS,2005,Federal
252,263,ESTAÇÃO ECOLÓGICA DA GUANABARA,2006,Federal
253,264,PARQUE NACIONAL DO RIO NOVO,2006,Federal
254,265,FLORESTA NACIONAL DO TRAIRÃO,2006,Federal
255,266,FLORESTA NACIONAL DO JAMANXIM,2006,Federal
256,267,PARQUE NACIONAL DO JAMANXIM,2006,Federal
257,268,ÁREA DE PROTEÇÃO AMBIENTAL DO TAPAJÓS,2006,Federal
258,269,FLORESTA NACIONAL DO IBURA,2005,Federal
259,270,FLORESTA NACIONAL DO CREPORI,2006,Federal
260,271,FLORESTA NACIONAL DO AMANÁ,2006,Federal
261,272,PARQUE NACIONAL DA CHAPADA DAS MESAS,2005,Federal
262,273,RESERVA EXTRATIVISTA ARIÓCA PRUANÃ,2005,Federal
263,274,RESERVA EXTRATIVISTA ALTO TARAUACÁ,2000,Federal
264,275,RESERVA BIOLÓGICA DAS PEROBAS,2006,Federal
265,276,RESERVA BIOLÓGICA DAS ARAUCÁRIAS,2006,Federal
266,277,PARQUE NACIONAL DOS CAMPOS GERAIS,2006,Federal
267,278,REFÚGIO DE VIDA SILVESTRE DOS CAMPOS DE PALMAS,2006,Federal
268,279,RESERVA EXTRATIVISTA DE CURURUPU,2004,Federal
269,280,RESERVA EXTRATIVISTA RIO IRIRI,2006,Federal
270,281,PARQUE NACIONAL DO JURUENA,2006,Federal
271,282,RESERVA EXTRATIVISTA TERRA GRANDE PRACUUBA,2006,Federal
272,283,RESERVA EXTRATIVISTA DO RIO UNINI,2006,Federal
273,284,PARQUE NACIONAL DOS CAMPOS AMAZÔNICOS,2006,Federal
274,285,RESERVA EXTRATIVISTA ARAPIXI,2006,Federal
275,286,RESERVA EXTRATIVISTA DO RECANTO DAS ARARAS DE TERRA RONCA,2006,Federal
276,287,RESERVA EXTRATIVISTA LAGO DO CEDRO,2006,Federal
277,288,RESERVA EXTRATIVISTA GURUPÁ-MELGAÇO,2006,Federal
278,291,RESERVA BIOLÓGICA DO PARAZINHO,1985,Estadual
279,292,RESERVA DE DESENVOLVIMENTO SUSTENTÁVEL DO RIO IRATAPURU,1997,Estadual
280,293,ÁREA DE PROTEÇÃO AMBIENTAL DO RIO CURIAÚ,1998,Estadual
281,294,ESTAÇÃO ECOLÓGICA ESTADUAL WENCESLAU GUIMARÃES,1997,Estadual
282,295,MONUMENTO NATURAL CACHOEIRA DO FERRO DOIDO,1998,Estadual
283,296,PARQUE ESTADUAL DO MORRO DO CHAPÉU,1998,Estadual
284,297,PARQUE ESTADUAL DAS SETE PASSAGENS,2000,Estadual
285,298,ÁREA DE RELEVANTE INTERESSE ECOLÓGICO NASCENTE DO RIO DE CONTAS,2001,Estadual
286,300,ÁREA DE RELEVANTE INTERESSE ECOLÓGICO SERRA DO OROBÓ,2002,Estadual
287,301,ÁREA DE PROTEÇÃO AMBIENTAL CAMINHOS ECOLÓGICOS DA BOA ESPERANÇA,2003,Estadual
288,302,ÁREA DE PROTEÇÃO AMBIENTAL PLATAFORMA CONTINENTAL DO LITORAL NORTE,2003,Estadual
289,303,ÁREA DE PROTEÇÃO AMBIENTAL GUAIBIM,1992,Estadual
290,304,ÁREA DE PROTEÇÃO AMBIENTAL TINHARÉ / BOIPEBA,1992,Estadual
291,305,ÁREA DE PROTEÇÃO AMBIENTAL BACIA DO RIO DE JANEIRO,1993,Estadual
292,306,ÁREA DE PROTEÇÃO AMBIENTAL PONTA DA BALEIA / ABROLHOS,1993,Estadual
293,307,ÁREA DE PROTEÇÃO AMBIENTAL SERRA DO BARBADO,1993,Estadual
294,308,ÁREA DE PROTEÇÃO AMBIENTAL COROA VERMELHA,1993,Estadual
295,309,ÁREA DE PROTEÇÃO AMBIENTAL COSTA DE ITACARÉ/ SERRA GRANDE,1993,Estadual
296,310,ÁREA DE PROTEÇÃO AMBIENTAL CARAÍVA/ TRANCOSO,1993,Estadual
297,311,ÁREA DE PROTEÇÃO AMBIENTAL MARIMBUS / IRAQUARA,1993,Estadual
298,312,ÁREA DE PROTEÇÃO AMBIENTAL LAGOA ENCANTADA,1993,Estadual
299,313,ÁREA DE PROTEÇÃO AMBIENTAL RIO CAPIVARA,1993,Estadual
300,314,ÁREA DE PROTEÇÃO AMBIENTAL GRUTAS DOS BREJÕES / VEREDAS DO ROMÃO GRAMACHO,1985,Estadual
301,315,ÁREA DE PROTEÇÃO AMBIENTAL LAGOAS E DUNAS DO ABAETÉ,1987,Estadual
302,316,ÁREA DE PROTEÇÃO AMBIENTAL LAGOAS DE GUARAJUBA,1991,Estadual
303,317,ÁREA DE PROTEÇÃO AMBIENTAL DUNAS E VEREDAS DO BAIXO MÉDIO SÃO FRANCISCO,1997,Estadual
304,318,ÁREA DE PROTEÇÃO AMBIENTAL LAGO DE PEDRA DO CAVALO,1997,Estadual
305,319,ÁREA DE PROTEÇÃO AMBIENTAL PRATIGI,1998,Estadual
306,320,ÁREA DE PROTEÇÃO AMBIENTAL BAÍA DE TODOS OS SANTOS,1999,Estadual
307,321,ÁREA DE PROTEÇÃO AMBIENTAL BACIA DO COBRE / SÃO BARTOLOMEU,2001,Estadual
308,322,ÁREA DE PROTEÇÃO AMBIENTAL SERRA BRANCA / RASO DA CATARINA,2001,Estadual
309,323,ÁREA DE PROTEÇÃO AMBIENTAL LITORAL NORTE,1992,Estadual
310,325,PARQUE ESTADUAL DA SERRA DO CONDURU,1997,Estadual
311,326,ÁREA DE PROTEÇÃO AMBIENTAL MANGUE SECO,1991,Estadual
312,327,ÁREA DE PROTEÇÃO AMBIENTAL SANTO ANTÔNIO,1994,Estadual
313,328,ÁREA DE PROTEÇÃO AMBIENTAL BAÍA DE CAMAMU,2002,Estadual
314,329,ÁREA DE PROTEÇÃO AMBIENTAL LAGOA DE ITAPARICA,1997,Estadual
315,331,PARQUE ESTADUAL DE ITAÚNAS,1991,Estadual
316,332,PARQUE ESTADUAL PAULO CÉSAR VINHA,1990,Estadual
317,333,ÁREA DE PROTEÇÃO AMBIENTAL DA LAGOA GUANANDY,1994,Estadual
318,334,ÁREA DE PROTEÇÃO AMBIENTAL DO PICO DO GOIAPABA-AÇU,1994,Estadual
319,335,ÁREA DE PROTEÇÃO AMBIENTAL DE PRAIA MOLE,1994,Estadual
320,336,ÁREA DE PROTEÇÃO AMBIENTAL CONCEIÇÃO DA BARRA,2007,Estadual
321,337,ÁREA DE PROTEÇÃO AMBIENTAL PEDRA DO ELEFANTE,2001,Estadual
322,338,ÁREA DE PROTEÇÃO AMBIENTAL DE SETIBA,1994,Estadual
323,353,ÁREA DE PROTEÇÃO AMBIENTAL JOÃO LEITE,2002,Estadual
324,355,ÁREA DE PROTEÇÃO AMBIENTAL BACIA DO RIO PANDEIROS,1995,Estadual
325,360,MONUMENTO NATURAL ESTADUAL GRUTA REI DO MATO,1984,Estadual
326,361,ÁREA DE PROTEÇÃO AMBIENTAL SERRA SÃO JOSÉ,1990,Estadual
327,362,PARQUE ESTADUAL RIO PRETO,1994,Estadual
328,363,ESTAÇÃO ECOLÓGICA MATA DOS AUSENTES,1974,Estadual
329,365,ESTAÇÃO ECOLÓGICA MAR DE ESPANHA,1974,Estadual
330,366,ESTAÇÃO ECOLÓGICA DE CORUMBÁ,1974,Estadual
331,367,ESTAÇÃO ECOLÓGICA DO TRIPUÍ,1978,Estadual
332,368,PARQUE ESTADUAL DO SUMIDOURO,1980,Estadual
333,370,ÁREA DE PROTEÇÃO AMBIENTAL VARGEM DAS FLORES,2006,Estadual
334,383,ESTAÇÃO ECOLÓGICA DE ÁGUA LIMPA,1994,Estadual
335,384,ESTAÇÃO ECOLÓGICA DE FECHOS,1994,Estadual
336,385,PARQUE ESTADUAL SERRA DO BRIGADEIRO,1996,Estadual
337,386,PARQUE ESTADUAL SERRA DAS ARARAS,1998,Estadual
338,387,PARQUE ESTADUAL GRÃO MOGOL,1998,Estadual
339,388,PARQUE ESTADUAL BIRIBIRI,1998,Estadual
340,389,RESERVA BIOLÓGICA SERRA AZUL,1998,Estadual
341,390,PARQUE ESTADUAL LAGOA DO CAJUEIRO,1998,Estadual
342,391,PARQUE ESTADUAL MATA SECA,2000,Estadual
343,392,ESTAÇÃO ECOLÓGICA MATA DO CEDRO,2000,Estadual
344,393,PARQUE ESTADUAL SERRA NEGRA,1998,Estadual
345,394,PARQUE ESTADUAL DO RIO DOCE,1944,Estadual
346,395,PARQUE ESTADUAL NOVA BADEN,1974,Estadual
347,397,PARQUE ESTADUAL VERDE GRANDE,1998,Estadual
348,398,PARQUE ESTADUAL SERRA DO ROLA MOÇA,1994,Estadual
349,399,ÁREA DE PROTEÇÃO AMBIENTAL CACHOEIRA DAS ANDORINHAS,1989,Estadual
350,400,ÁREA DE PROTEÇÃO AMBIENTAL SUL-RMBH,1994,Estadual
351,401,PARQUE ESTADUAL VEREDAS DO PERUAÇU,1994,Estadual
352,402,ÁREA DE PROTEÇÃO AMBIENTAL FERNÃO DIAS,1997,Estadual
353,403,PARQUE ESTADUAL SETE SALÕES,1998,Estadual
354,404,PARQUE ESTADUAL PICO DO ITAMBÉ,1998,Estadual
355,405,ÁREA DE PROTEÇÃO AMBIENTAL ÁGUAS VERTENTES,1998,Estadual
356,406,PARQUE ESTADUAL SERRA DO PAPAGAIO,1998,Estadual
357,407,ÁREA DE PROTEÇÃO AMBIENTAL LAJEDÃO,1998,Estadual
358,408,ÁREA DE PROTEÇÃO AMBIENTAL SERRA DO SABONETAL,1998,Estadual
359,409,PARQUE ESTADUAL RIO CORRENTE,1998,Estadual
360,410,PARQUE ESTADUAL SERRA DA CANDONGA,1998,Estadual
361,413,PARQUE ESTADUAL DO ITACOLOMI,1967,Estadual
362,415,RESERVA BIOLÓGICA JAÍBA,1973,Estadual
363,416,RESERVA DE DESENVOLVIMENTO SUSTENTÁVEL VEREDAS DO ACARI,2003,Estadual
364,417,PARQUE ESTADUAL DE SAGARANA,2003,Estadual
365,419,PARQUE ESTADUAL DO PROSA,2002,Estadual
366,420,PARQUE ESTADUAL DAS VÁRZEAS DO RIO IVINHEMA,1998,Estadual
367,421,PARQUE ESTADUAL DAS NASCENTES DO RIO TAQUARI,1999,Estadual
368,422,PARQUE ESTADUAL MATAS DO SEGREDO,2000,Estadual
369,423,PARQUE ESTADUAL DO PANTANAL DO RIO NEGRO,2000,Estadual
370,430,RESERVA PARTICULAR DO PATRIMÔNIO NATURAL RESERVA ECOLÓGICA VALE DO BUGIO,2003,Estadual
371,448,PARQUE ESTADUAL SERRA RICARDO FRANCO,1997,Estadual
372,451,ESTAÇÃO ECOLÓGICA DO RIO RONURO,1998,Estadual
373,453,ÁREA DE PROTEÇÃO AMBIENTAL DAS CABECEIRAS DO RIO CUIABÁ,1998,Estadual
374,454,PARQUE ESTADUAL ÁGUAS DO CUIABÁ,2002,Estadual
375,455,PARQUE ESTADUAL IGARAPÉS DO JURUENA,2002,Estadual
376,456,PARQUE ESTADUAL TUCUMÃ,2002,Estadual
377,457,RESERVA BIOLÓGICA CULUENE,1989,Estadual
378,460,PARQUE ESTADUAL DOM OSÓRIO STOFFEL,2002,Estadual
379,461,ÁREA DE PROTEÇÃO AMBIENTAL DA CHAPADA DOS GUIMARÃES,1995,Estadual
380,462,PARQUE ESTADUAL SERRA SANTA BÁRBARA,1997,Estadual
381,463,RESERVA EXTRATIVISTA GUARIBA-ROOSEVELT,1996,Estadual
382,464,PARQUE ESTADUAL MÃE BONIFÁCIA,2000,Estadual
383,465,PARQUE ESTADUAL GRUTA DA LAGOA AZUL,2000,Estadual
384,470,PARQUE ESTADUAL DO XINGU,2001,Estadual
385,472,PARQUE ESTADUAL SERRA AZUL,1994,Estadual
386,475,REFÚGIO DE VIDA SILVESTRE CORIXÃO DA MATA AZUL,2001,Estadual
387,476,REFÚGIO DE VIDA SILVESTRE QUELÔNIOS DO ARAGUAIA,2001,Estadual
388,477,PARQUE ESTADUAL DO GUIRÁ,2002,Estadual
389,478,ÁREA DE PROTEÇÃO AMBIENTAL DO SALTO MAGESSI,2002,Estadual
390,479,ÁREA DE PROTEÇÃO AMBIENTAL ESTADUAL PÉ DA SERRA AZUL,1994,Estadual
391,480,PARQUE ESTADUAL MASSAIRO OKAMURA,2000,Estadual
392,483,PARQUE ESTADUAL DA PEDRA DA BOCA,2000,Estadual
393,484,PARQUE ESTADUAL MARINHO DE AREIA VERMELHA,2000,Estadual
394,485,ÁREA DE PROTEÇÃO AMBIENTAL DAS ONÇAS,2002,Estadual
395,488,PARQUE ESTADUAL MATA DO XEM-XÉM,2000,Estadual
396,490,ÁREA DE PROTEÇÃO AMBIENTAL DE TAMBABA,2002,Estadual
397,495,FLORESTA ESTADUAL DE SANTANA,1994,Estadual
398,496,ÁREA DE PROTEÇÃO AMBIENTAL ESTADUAL GUARAQUEÇABA,1992,Estadual
399,497,ESTAÇÃO ECOLÓGICA DO GUARAGUAÇU,1992,Estadual
400,498,ÁREA DE PROTEÇÃO AMBIENTAL ESTADUAL DA ESCARPA DEVONIANA,1992,Estadual
401,499,PARQUE ESTADUAL DO CERRADO,1992,Estadual
402,500,ÁREA DE PROTEÇÃO AMBIENTAL ESTADUAL DE GUARATUBA,1992,Estadual
403,501,ÁREA DE PROTEÇÃO AMBIENTAL DO IRAÍ,1996,Estadual
404,502,ÁREA DE PROTEÇÃO AMBIENTAL ESTADUAL DO PIRAQUARA,1996,Estadual
405,504,PARQUE ESTADUAL DE IBIPORÃ,1980,Estadual
406,505,PARQUE ESTADUAL DO RIO GUARANI,2000,Estadual
407,506,ÁREA DE PROTEÇÃO AMBIENTAL DO RIO VERDE,2000,Estadual
408,511,PARQUE ESTADUAL DO LAGO AZUL,1997,Estadual
409,512,PARQUE ESTADUAL DO RIO DA ONÇA,1981,Estadual
410,513,PARQUE ESTADUAL DE CAMPINHOS,1960,Estadual
411,514,PARQUE ESTADUAL DO BOGUAÇU,1998,Estadual
412,515,ESTAÇÃO ECOLÓGICA RIO DOS TOUROS,2001,Estadual
413,516,ESTAÇÃO ECOLÓGICA FERNANDES PINHEIRO,2001,Estadual
414,517,FLORESTA ESTADUAL CÓRREGO DA BIQUINHA,1994,Estadual
415,518,PARQUE ESTADUAL DO PAU-OCO,1994,Estadual
416,519,PARQUE ESTADUAL MATA SÃO FRANCISCO,1994,Estadual
417,520,FLORESTA ESTADUAL METROPOLITANA,1988,Estadual
418,521,FLORESTA ESTADUAL DO PALMITO,1998,Estadual
419,522,PARQUE ESTADUAL DE IBICATU,1982,Estadual
420,524,PARQUE ESTADUAL ROBERTO RIBAS LANGE,1994,Estadual
421,525,PARQUE ESTADUAL DO PENHASCO VERDE,1991,Estadual
422,526,ÁREA DE PROTEÇÃO AMBIENTAL DO PASSAUNA,1991,Estadual
423,527,PARQUE ESTADUAL DA MATA DO GODOY,1989,Estadual
424,528,ESTAÇÃO ECOLÓGICA DA ILHA DO MEL,1982,Estadual
425,529,PARQUE ESTADUAL DA ILHA DO MEL,2002,Estadual
426,530,PARQUE ESTADUAL PROFESSOR JOSÉ WACCHOWICZ,2002,Estadual
427,531,PARQUE ESTADUAL SERRA DA BAITACA,2002,Estadual
428,532,PARQUE ESTADUAL PICO PARANÁ,2002,Estadual
429,533,REFÚGIO DE VIDA SILVESTRE DO PINHÃO.,1983,Estadual
430,534,PARQUE ESTADUAL DO CAXAMBU,1979,Estadual
431,538,FLORESTA ESTADUAL DO PASSA DOIS,1990,Estadual
432,539,RESERVA BIOLÓGICA SÃO CAMILO,1990,Estadual
433,540,PARQUE ESTADUAL DO PICO MARUMBI,1990,Estadual
434,541,PARQUE ESTADUAL DA GRACIOSA,1990,Estadual
